{
  "$schema": "./brand.schema.json",
  "schemaVersion": 1,
  "package": {
    "slug": "iblusend",
    "displayName": "iBluSend",
    "version": "1.0.0",
    "description": "Safely triage conversations, inspect contacts and devices, and send confirmed iMessages and SMS through one consented workspace.",
    "longDescription": "Connect one iBluSend workspace to inspect conversations, contacts, devices, groups, delivery status, opt-out state, and bot status. Draft and send only after showing the exact destination and content for approval.",
    "category": "Productivity",
    "capabilities": ["Interactive", "Read", "Write"],
    "keywords": ["imessage", "sms", "messaging", "contacts", "inbox", "crm"]
  },
  "publisher": {
    "name": "iBluSend",
    "developerName": "iBluSend",
    "email": "support@iblusend.com",
    "url": "https://iblusend.com",
    "repository": "https://github.com/ZachPulse/iblusend-plugins"
  },
  "legal": {
    "homepage": "https://iblusend.com/features/ai-assistants",
    "website": "https://iblusend.com",
    "support": "https://iblusend.com/support",
    "privacy": "https://iblusend.com/privacy",
    "terms": "https://iblusend.com/ai-usage-terms",
    "documentation": "https://iblusend.com/help/ai-assistants",
    "license": "MIT"
  },
  "mcp": {
    "serverName": "iblusend",
    "resourceUrl": "https://api.iblusend.com/functions/v1/agent-api/v1/mcp/public",
    "oauth": {
      "clientId": "https://claude.ai/oauth/claude-code-client-metadata",
      "scopes": "workspace:read messages:read contacts:read automation:read messages:send contacts:write automation:write",
      "authServerMetadataUrl": "https://iblusend.com/.well-known/oauth-authorization-server"
    }
  },
  "openai": {
    "appId": "asdk_app_6a8a543370988191833212380a71b2b9"
  },
  "branding": {
    "primaryColor": "#968EF6",
    "accentColor": "#4C79FF",
    "monogram": "IB",
    "composerIcon": {
      "kind": "source",
      "label": "iBluSend brand kit 1.5.1 app icon",
      "path": "./assets/iblusend/composer-icon.png",
      "sha256": "4f549fafdf51128f5f02f0df840abee603428c42d79e4602f1dd987c445ed9b4"
    },
    "lightLogo": {
      "kind": "source",
      "label": "iBluSend brand kit 1.5.1 light lockup",
      "path": "./assets/iblusend/logo-light.png",
      "sha256": "82bccaf49b2a6bdb98da95613cd03f831c603ffe9403c56203396a62ddfa77b4"
    },
    "darkLogo": {
      "kind": "source",
      "label": "iBluSend brand kit 1.5.1 dark lockup",
      "path": "./assets/iblusend/logo-dark.png",
      "sha256": "32a3ac1ee0b0a6cc1cef6f52fdc3dc108b534692211bfaecfba8f21e341db144"
    },
    "screenshots": [
      { "kind": "generated", "label": "Inbox triage workflow" },
      { "kind": "generated", "label": "Safe draft and send workflow" },
      { "kind": "generated", "label": "Contact and compliance workflow" }
    ]
  },
  "copy": {
    "channelName": "iMessage or SMS",
    "workspaceName": "iBluSend workspace",
    "starterPrompts": [
      "Triage my iBluSend inbox and flag conversations that need a reply.",
      "Draft a reply for one contact, then wait for my approval before sending.",
      "Check this contact's opt-out status and show available sending devices."
    ]
  },
  "marketplaces": {
    "codex": {
      "name": "iblusend-official",
      "displayName": "iBluSend Official",
      "installation": "AVAILABLE",
      "authentication": "ON_INSTALL"
    },
    "claude": {
      "name": "iblusend-official",
      "description": "Official iBluSend tools and guarded messaging workflows for one consented workspace."
    }
  },
  "infrastructureAttribution": {
    "allowedBrandReferences": []
  }
}
