{
  "$schema": "./brand.schema.json",
  "schemaVersion": 1,
  "package": {
    "slug": "imessage-sender",
    "displayName": "iMessage Sender",
    "version": "0.1.1",
    "description": "Safely triage conversations, inspect contacts and devices, and send confirmed iMessages and SMS through one consented workspace.",
    "longDescription": "Connect one iMessage Sender workspace to inspect conversations, contacts, devices, groups, delivery status, opt-out state, and bot status. Draft and send only after showing the exact destination and content for approval.",
    "category": "Productivity",
    "capabilities": ["Interactive", "Read", "Write"],
    "keywords": ["imessage", "sms", "messaging", "contacts", "inbox", "crm"]
  },
  "publisher": {
    "name": "iMessage Sender",
    "developerName": "iMessage Sender",
    "email": "support@imessagesender.com",
    "url": "https://imessagesender.com",
    "repository": "https://github.com/ZachPulse/iblusend-plugins"
  },
  "legal": {
    "homepage": "https://imessagesender.com",
    "website": "https://imessagesender.com",
    "support": "https://imessagesender.com/support",
    "privacy": "https://imessagesender.com/privacy",
    "terms": "https://imessagesender.com/terms",
    "license": "MIT"
  },
  "mcp": {
    "serverName": "imessage-sender",
    "resourceUrl": "https://api.iblusend.com/functions/v1/agent-api/v1/mcp/public"
  },
  "branding": {
    "primaryColor": "#2563EB",
    "accentColor": "#6366F1",
    "monogram": "IM",
    "composerIcon": { "kind": "generated", "label": "iMessage Sender composer icon" },
    "lightLogo": { "kind": "generated", "label": "iMessage Sender light logo" },
    "darkLogo": { "kind": "generated", "label": "iMessage Sender dark logo" },
    "screenshots": [
      { "kind": "generated", "label": "Inbox triage workflow" },
      { "kind": "generated", "label": "Safe draft and send workflow" },
      { "kind": "generated", "label": "Contact and compliance workflow" }
    ]
  },
  "copy": {
    "channelName": "iMessage or SMS",
    "workspaceName": "iMessage Sender workspace",
    "starterPrompts": [
      "Triage my messaging inbox and flag conversations that need a reply.",
      "Draft a reply for one contact, then wait for my approval before sending.",
      "Check this contact's opt-out status and show available sending devices."
    ]
  },
  "marketplaces": {
    "codex": {
      "name": "imessage-sender-private",
      "displayName": "iMessage Sender Private",
      "installation": "AVAILABLE",
      "authentication": "ON_INSTALL"
    },
    "claude": {
      "name": "imessage-sender-private",
      "description": "Private iMessage Sender tools and guarded messaging workflows for one consented workspace."
    }
  },
  "infrastructureAttribution": {
    "allowedBrandReferences": [
      "https://api.iblusend.com/functions/v1/agent-api/v1/mcp/public",
      "https://github.com/ZachPulse/iblusend-plugins"
    ]
  }
}
